{
  "schema_version": "4.5",
  "generated_at": "2026-04-17T07:10:00Z",
  "source": ".ultra/.runtime/state.db",
  "tasks": [
    {
      "id": "task-001",
      "title": "Phase 1 — three-layer interface contracts",
      "type": "architecture",
      "priority": "P0",
      "complexity": 6,
      "estimated_days": 2.5,
      "status": "in_progress",
      "deps": [],
      "files_modified": ["spec/mcp-tools.yaml", "spec/schemas/state-db.sql"],
      "session_id": "ses_2026_04_17_a1b2c3",
      "stale": false,
      "tag": "main",
      "trace_to": "spec/mcp-tools.yaml#task.create",
      "context_file": ".ultra/.runtime/projections/contexts/task-001.md",
      "created_at": "2026-04-17T07:00:00Z",
      "updated_at": "2026-04-17T07:05:00Z"
    },
    {
      "id": "task-002",
      "title": "Phase 2 — state.db",
      "type": "architecture",
      "priority": "P0",
      "status": "pending",
      "tag": "main",
      "created_at": "2026-04-17T07:00:00Z",
      "updated_at": "2026-04-17T07:00:00Z"
    }
  ]
}
